{
  "schema_version": 1,
  "project": "Gauntlet",
  "current_rules_version": "v0.6.0",
  "subjects": [
    {
      "subject_id": "neutral-pathfinders",
      "kind": "card",
      "decision_ids": [
        "GNT-DEC-2026-0730-002"
      ],
      "expected": {
        "name": "Pathfinders",
        "cost": 1,
        "trait": null,
        "unique": false,
        "action": "Choose one Territory. Its printed effect is inactive during your movement this turn.",
        "battle": "If this battle is on a Territory with an active printed effect, add +1 to your battle total."
      },
      "canonical": {
        "status": "complete",
        "paths": [
          "docs/Gauntlet_v0.6_Neutral_Card_Pool.md",
          "releases/v0.6.0/Gauntlet_v0.6.0_Canonical_Data.json"
        ]
      },
      "rules_reference": {
        "status": "complete",
        "paths": [
          "releases/v0.6.0/Gauntlet_v0.6.0_Complete_Card_Reference.md"
        ]
      },
      "engine": {
        "status": "complete",
        "paths": [
          "src/state/neutral-pathfinders.ts",
          "src/cards/playability.ts"
        ]
      },
      "deckbuilder": {
        "status": "unknown",
        "paths": []
      },
      "print_art": {
        "status": "unknown",
        "paths": []
      },
      "tests": {
        "status": "complete",
        "paths": [
          "src/state/neutral-pathfinders.test.ts",
          "src/state/neutral-audit-regressions.test.ts"
        ]
      },
      "overall_status": "implemented"
    },
    {
      "subject_id": "neutral-assimilation",
      "kind": "card",
      "decision_ids": [
        "GNT-DEC-2026-0730-003"
      ],
      "expected": {
        "name": "Assimilation",
        "cost": 4,
        "trait": null,
        "unique": false,
        "action": "Bank this as an Asset. After you win a battle you initiated on a Territory your opponent controls, you may put this in your Graveyard. If you do, capture that Territory immediately instead of occupying it.",
        "battle": "If you win as the attacking player on a Territory your opponent controls, capture that Territory immediately instead of occupying it. Put this in your Graveyard after the capture resolves."
      },
      "canonical": {
        "status": "complete",
        "paths": [
          "docs/Gauntlet_v0.6_Neutral_Card_Pool.md",
          "releases/v0.6.0/Gauntlet_v0.6.0_Canonical_Data.json"
        ]
      },
      "rules_reference": {
        "status": "complete",
        "paths": [
          "releases/v0.6.0/Gauntlet_v0.6.0_Complete_Card_Reference.md"
        ]
      },
      "engine": {
        "status": "complete",
        "paths": [
          "src/state/neutral-assimilation.ts",
          "src/state/apply-neutral.ts"
        ]
      },
      "deckbuilder": {
        "status": "unknown",
        "paths": []
      },
      "print_art": {
        "status": "unknown",
        "paths": []
      },
      "tests": {
        "status": "complete",
        "paths": [
          "src/state/neutral-assimilation.test.ts"
        ]
      },
      "overall_status": "implemented"
    },
    {
      "subject_id": "neutral-invasion",
      "kind": "card",
      "decision_ids": [
        "GNT-DEC-2026-0730-004"
      ],
      "expected": {
        "name": "Invasion",
        "cost": 4,
        "trait": null,
        "unique": false,
        "action": "Gain two additional positions of movement this turn. Movement granted by this card may be used only to advance. Resolve it one position at a time.",
        "battle": "If you are the attacking player, draw one additional card when forming your initial Battle Hand and you may choose one additional card from it."
      },
      "canonical": {
        "status": "complete",
        "paths": [
          "docs/Gauntlet_v0.6_Neutral_Card_Pool.md",
          "releases/v0.6.0/Gauntlet_v0.6.0_Canonical_Data.json"
        ]
      },
      "rules_reference": {
        "status": "complete",
        "paths": [
          "releases/v0.6.0/Gauntlet_v0.6.0_Complete_Card_Reference.md"
        ]
      },
      "engine": {
        "status": "complete",
        "paths": [
          "src/state/neutral-invasion.ts",
          "src/state/reducer.ts"
        ]
      },
      "deckbuilder": {
        "status": "unknown",
        "paths": []
      },
      "print_art": {
        "status": "unknown",
        "paths": []
      },
      "tests": {
        "status": "complete",
        "paths": [
          "src/state/neutral-invasion.test.ts"
        ]
      },
      "overall_status": "implemented"
    },
    {
      "subject_id": "neutral-armistice",
      "kind": "card",
      "decision_ids": [
        "GNT-DEC-2026-0730-005"
      ],
      "expected": {
        "name": "Armistice",
        "cost": 4,
        "trait": null,
        "unique": false,
        "action": "Bank this as an Asset. While this is active, neither player can initiate a battle. After your normal Draw step at the start of each of your turns, discard two cards from your hand or discard this. This cannot be voluntarily discarded at another time.",
        "battle": "Resolve effects that cancel cards first. If this is not canceled, end the battle without a winner. Return the attacking player to the position they entered from. Stop resolving Battle effects. Put all other cards still used in the battle in their owners' Discard Piles, then put this in its owner's Graveyard."
      },
      "canonical": {
        "status": "complete",
        "paths": [
          "docs/Gauntlet_v0.6_Neutral_Card_Pool.md",
          "releases/v0.6.0/Gauntlet_v0.6.0_Canonical_Data.json"
        ]
      },
      "rules_reference": {
        "status": "complete",
        "paths": [
          "releases/v0.6.0/Gauntlet_v0.6.0_Complete_Card_Reference.md"
        ]
      },
      "engine": {
        "status": "complete",
        "paths": [
          "src/state/neutral-armistice.ts",
          "src/state/apply-neutral.ts"
        ]
      },
      "deckbuilder": {
        "status": "unknown",
        "paths": []
      },
      "print_art": {
        "status": "unknown",
        "paths": []
      },
      "tests": {
        "status": "complete",
        "paths": [
          "src/state/neutral-armistice.test.ts"
        ]
      },
      "overall_status": "implemented"
    },
    {
      "subject_id": "neutral-decoys",
      "kind": "card",
      "decision_ids": [
        "GNT-DEC-2026-0730-006"
      ],
      "expected": {
        "name": "Decoys",
        "cost": 2,
        "trait": null,
        "unique": false,
        "action": "Bank this as an Asset. If an opposing effect would cause one or more of your other Assets to leave play, you may discard this. If you do, choose one affected Asset; it remains in play.",
        "battle": "An opposing effect that cancels a card used in this battle must target this before another active card you used, if able."
      },
      "canonical": {
        "status": "complete",
        "paths": [
          "docs/Gauntlet_v0.6_Neutral_Card_Pool.md",
          "releases/v0.6.0/Gauntlet_v0.6.0_Canonical_Data.json"
        ]
      },
      "rules_reference": {
        "status": "complete",
        "paths": [
          "releases/v0.6.0/Gauntlet_v0.6.0_Complete_Card_Reference.md"
        ]
      },
      "engine": {
        "status": "complete",
        "paths": [
          "src/state/neutral-decoys.ts",
          "src/state/neutral-decoys-battle.ts",
          "src/state/apply-neutral.ts"
        ]
      },
      "deckbuilder": {
        "status": "unknown",
        "paths": []
      },
      "print_art": {
        "status": "unknown",
        "paths": []
      },
      "tests": {
        "status": "complete",
        "paths": [
          "src/state/neutral-decoys.test.ts"
        ]
      },
      "overall_status": "implemented"
    },
    {
      "subject_id": "neutral-arcane-knowledge",
      "kind": "card",
      "decision_ids": [
        "GNT-DEC-2026-0730-007"
      ],
      "expected": {
        "name": "Arcane Knowledge",
        "cost": 4,
        "trait": "Arcane",
        "unique": false,
        "action": "Move one card from your Graveyard to your Discard Pile.",
        "battle": "When this is revealed, choose one card in your Graveyard with a Battle effect that can resolve in this battle. Resolve that effect as though you had used it. Leave the chosen card in your Graveyard."
      },
      "canonical": {
        "status": "complete",
        "paths": [
          "docs/Gauntlet_v0.6_Neutral_Card_Pool.md",
          "releases/v0.6.0/Gauntlet_v0.6.0_Canonical_Data.json"
        ]
      },
      "rules_reference": {
        "status": "complete",
        "paths": [
          "releases/v0.6.0/Gauntlet_v0.6.0_Complete_Card_Reference.md"
        ]
      },
      "engine": {
        "status": "quarantined",
        "paths": [
          "src/state/neutral-arcane-knowledge.ts",
          "src/cards/neutral-audit-containment.ts"
        ]
      },
      "deckbuilder": {
        "status": "unknown",
        "paths": []
      },
      "print_art": {
        "status": "unknown",
        "paths": []
      },
      "tests": {
        "status": "partial",
        "paths": [
          "src/state/neutral-arcane-knowledge.test.ts"
        ]
      },
      "overall_status": "quarantined",
      "quarantine_reason": "The Battle copier supports only a small allowlist and cannot yet resolve all legally eligible Battle effects at their correct timings."
    },
    {
      "subject_id": "neutral-bombardment",
      "kind": "card",
      "decision_ids": [
        "GNT-DEC-2026-0730-008"
      ],
      "expected": {
        "name": "Bombardment",
        "cost": 4,
        "trait": null,
        "unique": false,